{"contract_version":"patent-research.v2","artifact_type":"RetrievalManifest","corpus_id":"sha256:0000000000000000000000000000000000000000000000000000000000000000","scope":{"applicants":[{"name":"Example Electric","status":"confirmed"}],"technology":"hydrogen combustor","jurisdictions":["CN"]},"cutoff":"2026-07-17","query_runs":[{"query_id":"q1","query_text":"TACD:(hydrogen AND combustor)","syntax_version":"p002-query-v2-2026-07","limit":100,"offset":0,"returned":1,"charged_cny":0.2}],"ordered_pns":["CN1A"],"batches":[{"batch_id":"b1","requested":["CN1A"],"returned":["CN1A"],"missing":[],"processed":["CN1A"],"charged_cny":0.2}],"coverage":{"boundary":"fixture"},"search_gap_requests":[]}
